<?xml version='1.0'?>
<xs:schema xmlns:xs="http://www.w3.org/2001/XMLSchema"
           targetNamespace="http://www.xpriv.com/rules"
           xmlns="http://www.xpriv.com/rules"
           elementFormDefault="qualified">

    <xs:complexType name="subtreeType">
        <xs:attribute name="xpath" type="xs:string" use="required"/>
    </xs:complexType>

    <xs:complexType name="subtreeQuasiType">
        <xs:sequence>
            <xs:element name="AttributeManager" type="xs:string"/>
        </xs:sequence>
        <xs:attribute name="xpath" type="xs:string" use="required"/>
    </xs:complexType>

    <xs:complexType name="subtreeListType">
        <xs:sequence>
            <xs:element name="subtree" type="subtreeType" minOccurs="0" maxOccurs="unbounded"/>
        </xs:sequence>
    </xs:complexType>

    <xs:complexType name="subtreeListQuasiType">
        <xs:sequence>
            <xs:element name="subtree" type="subtreeQuasiType" minOccurs="0" maxOccurs="unbounded"/>
        </xs:sequence>
    </xs:complexType>

    <xs:element name="rules">
        <xs:complexType>
            <xs:sequence>
                <xs:element name="attribute_mapping">
                    <xs:complexType>
                        <xs:sequence>
                            <xs:element name="direct" type="subtreeListType" minOccurs="0"/>
                            <xs:element name="quasi" type="subtreeListQuasiType" minOccurs="0"/>
                            <xs:element name="sensitive" type="subtreeListType" minOccurs="0"/>
                            <xs:element name="insensitive" type="subtreeListType" minOccurs="0"/>
                        </xs:sequence>
                    </xs:complexType>
                </xs:element>
                <xs:element name="entity_level">
                    <xs:complexType>
                        <xs:attribute name="xpath" type="xs:string" use="required"/>
                    </xs:complexType>
                </xs:element>
            </xs:sequence>
        </xs:complexType>
    </xs:element>

</xs:schema>