<?xml version="1.0" encoding="UTF-8"?>
<rules xmlns="http://www.xpriv.com/rules"
       xmlns:xsi="http://www.w3.org/2001/XMLSchema-instance"
       xsi:schemaLocation="http://www.xpriv.com/rules rules.xsd">

    <k_anonymity>2</k_anonymity>
    
    <attribute_mapping>
        <direct>
            <subtree xpath="/dataset/person/aadharNumber"/>
            <subtree xpath="/dataset/person/firstName"/>
            <subtree xpath="/dataset/person/lastName"/>
            <!-- <subtree xpath="/dataset/person/address/house/houseNumber"/> -->
            <!-- <subtree xpath="/dataset/person/address/house/street"/> -->
        </direct>
        
        <quasi>
            <subtree xpath="./age">
                <AttributeHandler>custom.AgeHandler.AgeHandler</AttributeHandler>
            </subtree>
            <!-- <subtree xpath="/dataset/person/gender">
                <AttributeHandler>suppression</AttributeHandler>
            </subtree>
            <subtree xpath="/dataset/person/occupation">
                <AttributeHandler>industry_generalization</AttributeHandler>
            </subtree>
            <subtree xpath="/dataset/person/education">
                <AttributeHandler>degree_level_generalization</AttributeHandler>
            </subtree>
            <subtree xpath="/dataset/person/maritalStatus">
                <AttributeHandler>suppression</AttributeHandler>
            </subtree> -->

            <!-- <subtree xpath="/dataset/person/address/location/city">
                <AttributeHandler>regional_generalization</AttributeHandler>
            </subtree>
            <subtree xpath="/dataset/person/address/location/state">
                <AttributeHandler>retention</AttributeHandler>
            </subtree>
            <subtree xpath="/dataset/person/address/location/pincode">
                <AttributeHandler>mask_last_3_digits</AttributeHandler> -->
            <!-- </subtree> -->
        </quasi>
        
        <sensitive>
            <subtree xpath="/dataset/person/disease"/>
            <subtree xpath="/dataset/person/incomeBracket"/>
        </sensitive>
        
        <insensitive>
            <subtree xpath="/dataset/person/bloodGroup"/>
            <subtree xpath="/dataset/person/address/location/country"/>
        </insensitive>
    </attribute_mapping>
    
    <entity_level xpath="/dataset/*"></entity_level>
    
</rules>